{"schema_version":2,"ballot_id":"ballot.031","suite_id":"chat01-qinweixi-v2","rubric_id":"chat01-quality-rubric-v1","unit_id":"human.pair.serious_support.01","reviewer_id":"ui-smoke-reviewer","presentation":{"assignment_id":"assignment.be1c66428aa1994c444fe6c3","randomization_seed":1000033,"order_commitment_sha256":"77fef87efbf9efb76f79462d24e7b323338a1448b2f248e0e5604c30bb370a01"},"candidate_a_output_id":"output.807e6af9dd8911b5d25f84ca","candidate_b_output_id":"output.a0a4174a46f30cf6baa13cf1","dimension_scores":{"relevance":{"candidate_a":5,"candidate_b":5},"correctness":{"candidate_a":5,"candidate_b":5},"persona_fit":{"candidate_a":5,"candidate_b":2},"relationship_naturalness":{"candidate_a":5,"candidate_b":1},"emotion_fit":{"candidate_a":5,"candidate_b":3},"naturalness":{"candidate_a":5,"candidate_b":5}},"verdict":"a_much_better","failure_reasons":{"candidate_a":[],"candidate_b":[]},"both_unacceptable":false,"rationale":"","submitted_at":"2026-08-06T11:25:53.246+08:00","revealed":false}
