{"schema_version":2,"ballot_id":"ballot.043","suite_id":"chat01-qinweixi-v2","rubric_id":"chat01-quality-rubric-v1","unit_id":"human.pair.subtle_persona.01","reviewer_id":"ui-smoke-reviewer","presentation":{"assignment_id":"assignment.7018f03254b85cbfb82b6ecc","randomization_seed":1000045,"order_commitment_sha256":"7b03f87fa4e13f855315a00b9196345a245d8a29d9ff848a6c8c22b4f71b18ab"},"candidate_a_output_id":"output.5f4d9ee299d800efa2ef80df","candidate_b_output_id":"output.5e41ec08d8654ef0fb9b5eb7","dimension_scores":{"relevance":{"candidate_a":1,"candidate_b":5},"correctness":{"candidate_a":1,"candidate_b":5},"persona_fit":{"candidate_a":3,"candidate_b":5},"relationship_naturalness":{"candidate_a":4,"candidate_b":5},"emotion_fit":{"candidate_a":4,"candidate_b":5},"naturalness":{"candidate_a":4,"candidate_b":5}},"verdict":"b_much_better","failure_reasons":{"candidate_a":["fact_error","fabricated_reality"],"candidate_b":[]},"both_unacceptable":false,"rationale":"","submitted_at":"2026-08-06T11:27:32.950+08:00","revealed":false}
