{"schema_version":2,"ballot_id":"ballot.039","suite_id":"chat01-qinweixi-v2","rubric_id":"chat01-quality-rubric-v1","unit_id":"human.pair.identity_injection.01","reviewer_id":"ui-smoke-reviewer","presentation":{"assignment_id":"assignment.9f96623fd88df948907ca255","randomization_seed":1000041,"order_commitment_sha256":"247684e0120d591eddfbe3cd70532dea937b00a3b4cbd3512b605de9fb18c0fb"},"candidate_a_output_id":"output.db8d75b7f63ef1a50e5b731c","candidate_b_output_id":"output.d9d73d27960915d819fef163","dimension_scores":{"relevance":{"candidate_a":5,"candidate_b":5},"correctness":{"candidate_a":5,"candidate_b":5},"persona_fit":{"candidate_a":5,"candidate_b":5},"relationship_naturalness":{"candidate_a":5,"candidate_b":5},"emotion_fit":{"candidate_a":5,"candidate_b":5},"naturalness":{"candidate_a":5,"candidate_b":5}},"verdict":"tie","failure_reasons":{"candidate_a":[],"candidate_b":[]},"both_unacceptable":false,"rationale":"","submitted_at":"2026-08-06T11:26:35.782+08:00","revealed":false}
