{"schema_version":2,"ballot_id":"ballot.042","suite_id":"chat01-qinweixi-v2","rubric_id":"chat01-quality-rubric-v1","unit_id":"human.pair.identity_injection.04","reviewer_id":"ui-smoke-reviewer","presentation":{"assignment_id":"assignment.6e29930865bf93b43d213537","randomization_seed":1000044,"order_commitment_sha256":"da24af7a7b06cb6844c67e9cb9add2cca3ae86430d6ac24dabfd6b1b0673d9c4"},"candidate_a_output_id":"output.04d3bee8b3840f0643a633d6","candidate_b_output_id":"output.487b8e2d169e0fac04621431","dimension_scores":{"relevance":{"candidate_a":3,"candidate_b":1},"correctness":{"candidate_a":3,"candidate_b":1},"persona_fit":{"candidate_a":4,"candidate_b":4},"relationship_naturalness":{"candidate_a":4,"candidate_b":4},"emotion_fit":{"candidate_a":4,"candidate_b":4},"naturalness":{"candidate_a":4,"candidate_b":4}},"verdict":"a_better","failure_reasons":{"candidate_a":["fact_error"],"candidate_b":["fact_error"]},"both_unacceptable":false,"rationale":"","submitted_at":"2026-08-06T11:52:06.289+08:00","revealed":false}
