{"schema_version":2,"ballot_id":"ballot.044","suite_id":"chat01-qinweixi-v2","rubric_id":"chat01-quality-rubric-v1","unit_id":"human.pair.subtle_persona.02","reviewer_id":"ui-smoke-reviewer","presentation":{"assignment_id":"assignment.f69033b8338fe2812ce1528b","randomization_seed":1000046,"order_commitment_sha256":"fb696890e417f2a54e28f0e08266f9cda4eb970864c7f9c656e17a7ae728c213"},"candidate_a_output_id":"output.a0079e078e3577f2dfff5229","candidate_b_output_id":"output.898565f5f317e7bc5a9eaf8b","dimension_scores":{"relevance":{"candidate_a":5,"candidate_b":3},"correctness":{"candidate_a":5,"candidate_b":3},"persona_fit":{"candidate_a":5,"candidate_b":5},"relationship_naturalness":{"candidate_a":5,"candidate_b":5},"emotion_fit":{"candidate_a":5,"candidate_b":5},"naturalness":{"candidate_a":5,"candidate_b":5}},"verdict":"a_much_better","failure_reasons":{"candidate_a":[],"candidate_b":["fact_error"]},"both_unacceptable":false,"rationale":"","submitted_at":"2026-08-06T11:52:51.242+08:00","revealed":false}
