{"schema_version":2,"ballot_id":"ballot.024","suite_id":"chat01-qinweixi-v2","rubric_id":"chat01-quality-rubric-v1","unit_id":"human.pair.relationship_probe.04","reviewer_id":"ui-smoke-reviewer","presentation":{"assignment_id":"assignment.07fa77c893b3b2ddc67cc977","randomization_seed":1000026,"order_commitment_sha256":"aac076bb6fcbbb476b650c7957d5e7d35b4fee58af0ab17c93a97d6edce8e2f6"},"candidate_a_output_id":"output.c0225dc224420eb58d7c72be","candidate_b_output_id":"output.e2dce84f8c2488fe75b1f25f","dimension_scores":{"relevance":{"candidate_a":1,"candidate_b":5},"correctness":{"candidate_a":1,"candidate_b":5},"persona_fit":{"candidate_a":1,"candidate_b":5},"relationship_naturalness":{"candidate_a":3,"candidate_b":5},"emotion_fit":{"candidate_a":5,"candidate_b":5},"naturalness":{"candidate_a":5,"candidate_b":5}},"verdict":"b_much_better","failure_reasons":{"candidate_a":["off_topic","fact_error","emotion_mismatch"],"candidate_b":[]},"both_unacceptable":false,"rationale":"","submitted_at":"2026-08-06T11:46:32.456+08:00","revealed":false}
