{"schema_version":2,"ballot_id":"ballot.021","suite_id":"chat01-qinweixi-v2","rubric_id":"chat01-quality-rubric-v1","unit_id":"human.pair.relationship_probe.01","reviewer_id":"ui-smoke-reviewer","presentation":{"assignment_id":"assignment.676dafc5e9c10d3e86cc0a64","randomization_seed":1000023,"order_commitment_sha256":"633578973639ccee4f2ed5276aae7471be923d96c787111a2f09a6f7d142d93f"},"candidate_a_output_id":"output.b8202ab682e00a20c74b4df1","candidate_b_output_id":"output.3d953a6b220cc223a96e65bf","dimension_scores":{"relevance":{"candidate_a":5,"candidate_b":3},"correctness":{"candidate_a":5,"candidate_b":3},"persona_fit":{"candidate_a":5,"candidate_b":5},"relationship_naturalness":{"candidate_a":5,"candidate_b":1},"emotion_fit":{"candidate_a":5,"candidate_b":5},"naturalness":{"candidate_a":5,"candidate_b":5}},"verdict":"a_much_better","failure_reasons":{"candidate_a":[],"candidate_b":["relationship_boundary"]},"both_unacceptable":false,"rationale":"B 不能答应当正式的女朋友","submitted_at":"2026-08-06T11:25:09.970+08:00","revealed":false}
